{"endpoint":"quack:127.0.0.1:9494","identity":{"product":"quackridge","product_version":"0.1.0-dev","protocol_version":1,"metadata_version":1,"source_types":["postgres"],"read_only":true,"capabilities":["cancellation_noop","metadata_v1","pairing_v1","query_ids","sticky_sessions"]},"token":"01234567890123456789012345678901","expires_at":"2026-08-11T20:00:00Z"}
